{
  "$schema": "http://json-schema.org/draft-07/schema#",
  "$id": "https://democracy-index.cz/schemas/event.schema.json",
  "title": "Event",
  "description": "Single event affecting the democracy index. Stored in data/events/YYYY-Wxx.json (array of these objects).",
  "type": "object",
  "required": [
    "id",
    "date",
    "headline",
    "summary",
    "pillar",
    "severity",
    "direction",
    "duration",
    "sources",
    "score_impact",
    "rationale",
    "reviewer",
    "status",
    "created_at"
  ],
  "additionalProperties": false,
  "properties": {
    "id": {
      "type": "string",
      "pattern": "^[0-9]{4}-W(0[1-9]|[1-4][0-9]|5[0-3])-[0-9]{3}$",
      "description": "Stable identifier YYYY-Www-NNN, e.g. 2026-W17-001."
    },
    "date": {
      "type": "string",
      "format": "date",
      "description": "ISO 8601 date the event occurred (not the date it was processed)."
    },
    "headline": {
      "type": "string",
      "minLength": 5,
      "maxLength": 200
    },
    "summary": {
      "type": "string",
      "minLength": 20,
      "maxLength": 600,
      "description": "1–3 sentences, paraphrase only. No verbatim quotes longer than 15 words."
    },
    "pillar": {
      "type": "string",
      "enum": ["electoral", "governance", "judicial", "media", "civil", "corruption"]
    },
    "severity": {
      "oneOf": [
        { "type": "integer", "minimum": 1, "maximum": 5 },
        { "type": "null" }
      ],
      "description": "1–5 per methodology/severity_rubric.md, or null when reviewer flag is required."
    },
    "direction": {
      "type": "integer",
      "enum": [-1, 0, 1],
      "description": "-1 = democracy weakened, +1 = strengthened, 0 = ambiguous/needs review."
    },
    "duration": {
      "type": "string",
      "enum": ["one_off", "persistent"],
      "description": "one_off events decay linearly over 12 weeks. persistent events stay until status is set to resolved."
    },
    "sources": {
      "type": "array",
      "minItems": 1,
      "items": {
        "type": "object",
        "required": ["title", "url", "outlet", "fetched_at"],
        "additionalProperties": false,
        "properties": {
          "title": { "type": "string", "minLength": 1 },
          "url": { "type": "string", "format": "uri" },
          "outlet": { "type": "string", "minLength": 1 },
          "fetched_at": { "type": "string", "format": "date-time" }
        }
      }
    },
    "score_impact": {
      "type": "number",
      "minimum": -6.0,
      "maximum": 6.0,
      "description": "Signed magnitude applied to pillar subscore. Derived deterministically from severity * direction per the rubric."
    },
    "rationale": {
      "type": "string",
      "minLength": 20,
      "description": "Why this severity and pillar. Must reference a specific criterion in methodology/severity_rubric.md."
    },
    "reviewer": {
      "type": "string",
      "enum": ["manual", "auto"],
      "description": "auto = classified by Claude only; manual = human approved before merge."
    },
    "status": {
      "type": "string",
      "enum": ["active", "resolved", "disputed", "needs_review"]
    },
    "created_at": {
      "type": "string",
      "format": "date-time"
    },
    "expires_at": {
      "type": "string",
      "format": "date-time",
      "description": "Optional. For one_off events, the timestamp at which aged impact reaches zero."
    }
  },
  "allOf": [
    {
      "if": { "properties": { "status": { "const": "active" } }, "required": ["status"] },
      "then": { "properties": { "severity": { "type": "integer" } } }
    }
  ]
}
