[
  {
    "id": "2025-W41-001",
    "date": "2025-10-06",
    "headline": "Pavel potvrdil koaliční vyjednávání ANO, SPD a Motoristů s Babišem jako kandidátem na premiéra",
    "summary": "Prezident Petr Pavel oznámil, že probíhají koaliční vyjednávání tří stran — ANO, SPD a Motoristů. Podle dohody má ANO obsadit osm ministerstev, Motoristé čtyři a SPD tři. Andrej Babiš je kandidátem na předsedu vlády.",
    "pillar": "electoral",
    "severity": 1,
    "direction": 0,
    "duration": "one_off",
    "sources": [
      {
        "title": "Pavel potvrdil koaliční vyjednávání ANO, SPD a Motoristů",
        "url": "https://www.denik.cz/z_domova/parlamentni-volby-2025-vysledky-voleb-aktualne-20251004.html",
        "outlet": "Deník.cz",
        "fetched_at": "2026-04-29T07:18:07.804Z"
      }
    ],
    "score_impact": 0,
    "rationale": "Severity 1 per rubric §1 — jde o standardní povolební vyjednávání, které je přirozenou součástí demokratického procesu předání moci (subkomponenta E4). Prezidentovo potvrzení probíhajících jednání je rutinní institucionální úkon bez negativního dopadu na demokratické normy. Direction 0: událost sama o sobě není ani pozitivní, ani negativní pro stav demokracie — je to prostý popis formování vlády po volbách.",
    "reviewer": "auto",
    "status": "active",
    "created_at": "2025-10-06T00:00:00.000Z",
    "expires_at": "2025-12-29T00:00:00.000Z"
  },
  {
    "id": "2025-W41-002",
    "date": "2025-10-12",
    "headline": "Státní analytik tvrdí, že byl propuštěn za odborný nesouhlas s vládním zmocněncem Turkem",
    "summary": "Martin Abel, analytik ve státní správě, uvádí, že byl propuštěn krátce poté, co veřejně odporoval argumentům vládního zmocněnce Filipa Turka. Abel označuje svůj odchod za politicky motivovaný personální zásah jako reakci na věcný nesouhlas, nikoliv na pracovní selhání.",
    "pillar": "governance",
    "severity": 2,
    "direction": -1,
    "duration": "one_off",
    "sources": [
      {
        "title": "Vyhozený státní analytik: Motoristé řeší ideologické konflikty propouštěním",
        "url": "https://denikn.cz/2045505/turek-vse-znici-buldozerem-motoriste-si-vyrizuji-ideologicke-konflikty-propoustenim-rika-vyhozeny-analytik/",
        "outlet": "Deník N",
        "fetched_at": "2026-04-29T07:18:07.804Z"
      }
    ],
    "score_impact": -0.5,
    "rationale": "Severity 2 per rubric §2 — politicky motivovaný personální zásah na střední úrovni státní správy (subkomponenta G1) bez dosud prokázaného kaskádového efektu. Případ zatím vychází primárně z výpovědi jednoho zdroje (samotný Abel), což podle pravidla 'single source' snižuje jistotu a odpovídá spíše úrovni 2. Pokud se prokáže systematický vzorec propouštění odborníků za nesouhlas s ideologickými pozicemi, eskalace na 3+. Sekundárně se dotýká subkomponenty C3 (svoboda sdružování a profesní nezávislost), ale kořen je v G1 — kontrola exekutivy nad veřejnou správou.",
    "reviewer": "auto",
    "status": "active",
    "created_at": "2025-10-06T00:00:00.000Z",
    "expires_at": "2026-01-04T00:00:00.000Z"
  }
]
